{
  "schemaVersion": 1,
  "id": "image-editing-proposal",
  "version": 1,
  "tier": "T2",
  "title": "Proposal image editing: flood fill and luma Gaussian pipeline",
  "description": "Out-of-catalog proposal shard over generated straight-alpha RGBA bytes. It defines exact controlled JavaScript and fixed-memory scalar Wasm results but supplies no browser timing evidence or catalog-v1 coverage.",
  "tracks": ["controlled"],
  "variants": [
    {
      "id": "js-controlled",
      "target": "javascript",
      "track": "controlled",
      "buildManifest": "benchmarks/image-editing/artifacts/build-manifest.json"
    },
    {
      "id": "wasm-linear-controlled",
      "target": "wasm-linear",
      "track": "controlled",
      "buildManifest": "benchmarks/image-editing/artifacts/build-manifest.json"
    }
  ],
  "inputs": {
    "manifestSha256": "581b0fcad4a032751d7f6b2aed2aa865ff9034bb90962c3ea00b7ac07e660549",
    "immutable": true,
    "generation": "Integer-only repository generator with fixed seeds emits raw row-major straight-alpha RGBA8 fixtures; generated bytes are dedicated under CC0-1.0."
  },
  "oracle": {
    "kind": "canonical-digest-and-invariants",
    "policy": "Flood fill requires exact output RGBA and visited-mask hashes, changed count, bounds, and work counters. The luma plus separable 3-tap Gaussian pipeline requires exact output RGBA and counters. Small adversarial cases compare every byte.",
    "floatingPointPolicy": "No floating-point operations occur in either controlled algorithm. All arithmetic, thresholds, coefficients, borders, shifts, and rounding are unsigned integer operations defined in measurement-contract.json.",
    "deadCodeDefense": "Correctness reads and hashes every output byte and the complete flood visited mask outside the resident algorithm phase. Timing is not authorized by this proposal shard."
  },
  "work": {
    "fixed": true,
    "complexity": "Flood fill is O(visited pixels); the luma Gaussian pipeline is three fixed O(width*height) passes.",
    "counters": [
      "operations",
      "read-bytes",
      "write-bytes",
      "visited-pixels",
      "changed-pixels",
      "neighbor-tests",
      "stack-pushes",
      "stack-pops",
      "max-frontier",
      "copied-bytes",
      "allocations",
      "allocation-bytes",
      "boundary-crossings"
    ],
    "tolerance": "Controlled output bytes, masks, dimensions, algorithm counters, copied bytes, and crossings match exactly. Target-owned materialization allocation counts remain separately reported because Wasm owns one pre-instantiated linear memory."
  },
  "missingCells": [
    {
      "cell": "Track B optimized variants",
      "reason": "No optimized algorithm is proposed in this shard."
    },
    {
      "cell": "Canvas upload and presentation proxy timings",
      "reason": "The phase contract is declared, but no authoritative browser performance run is authorized."
    },
    {
      "cell": "catalog v1 implementation coverage",
      "reason": "The frozen 38-row catalog is unchanged; this proposal cannot claim coverage."
    }
  ]
}
